<!ELEMENT librairie (entete, livre)>
    <!ENTITY % balises "(#PCDATA|strong|em|img)*">
        <!ELEMENT entete %balises; %copyright;>
        <!ENTITY copyright "&#xA9;Librairie &amp; Internet 2020">
        <!ELEMENT strong (#PCDATA)>
        <!ELEMENT em (#PCDATA)>
        <!ELEMENT img EMPTY>
        <!ATTLIST img src CDATA #REQUIRED
                      title CDATA #IMPLIED>
    <!ELEMENT  livre (titre, auteur*, description, prix)>
    <!ATTLIST livre num_ISBN ID #REQUIRED>
        <!ELEMENT titre (#PCDATA)>
        <!ELEMENT auteur (auteurs*|collectif)>
            <!ENTITY % appelation "(nom, prenom?)">
            <!ELEMENT auteurs %appelation;+>
                <!ELEMENT nom (#PCDATA)>
                <!ELEMENT prenom (#PCDATA)>
            <!ELEMENT collectif (direction, membre)
                <!ELEMENT direction %appelation;>
                <!ELEMENT membre (#PCDATA)>
        <!ELEMENT description %balises;>
        <!ELEMENT prix (prixAchat)>
        <!ATTLIST prix tva #FIXED"5.5"
                       type ("HT" | TTC)
                       devise ("euros" | livres | dollars)>
            <!ELEMENT prixAchat (#PCDATA)>

            <!ATTLIST type (HT|TTC)>
